{
  "schema_version":"fz-manual-test-result-v2",
  "indicator_id":"fractal-zones",
  "indicator_version_state":"current_merged_runtime_validated_build_not_publicly_versioned",
  "suite_id":"FZV2-RM",
  "exported_at_utc":"2026-08-23T00:00:00Z",
  "notes_included":false,
  "results":[{"test_id":"FZV2-RM-001","status":"open"}]
}
